MP ID,MP Name,Region Id,GL Code,GL Name,Parent ASIN,ASIN,Review Id,Review Title,Review Text,Review Rating,Brand,Submission Date,Last Updated DateTime,Week Number
1,1 - US,1,147,gl_pc,B01N5UOYC4,B01N5UOYC4,52205535021,Crisp Camera in 4K. 👍🏾👍🏾👍🏾,Crisp picture. Great sound. USB C cable fir fast streaming speeds. Very satisfied.,5,Logitech,2025-04-23T04:22:52.000Z,2025-08-19T22:33:08.000Z,2025/4/19 00:00
1,1 - US,1,147,gl_pc,B01N5UOYC4,B01N5UOYC4,75393449061,Trash. Soft focused video. Everyone has that issue!,Trash. Soft focused video. Everyone has that issue!,2,Logitech,2025-04-09T13:53:51.000Z,2025-07-31T07:49:39.000Z,2025/4/5 00:00
1,1 - US,1,147,gl_pc,B01N5UOYC4,B01N5UOYC4,75439740381,good,amazing quality,5,Logitech,2025-04-11T20:34:11.000Z,2025-08-17T23:23:42.000Z,2025/4/5 00:00
1,1 - US,1,147,gl_pc,B01N5UOYC4,B01N5UOYC4,75445053131,Great video quality,"good mounting solution so that it works in most scenario, great picture quality got 4K and HDR, supports windows hello, normal size, plug and play with ease.",5,Logitech,2025-04-12T03:31:58.000Z,2025-08-24T11:43:48.000Z,2025/4/12 00:00
1,1 - US,1,147,gl_pc,B01N5UOYC4,B01N5UOYC4,75618010351,Good For zoom meeting. work fine and very easy to use.,Good For zoom meeting. work fine and very easy to use.,5,Logitech,2025-04-21T15:45:35.000Z,2025-08-24T08:14:31.000Z,2025/4/19 00:00
1,1 - US,1,147,gl_pc,B01N5UOYC4,B01N5UOYC4,75965498851,Does not work with Windows 7 systems,"Would not turn on with my Windows 7 OS and I updated the driver and downloaded the control app for the camera and my computer recognized that it was installed, but the camera would not turn on. I returned it for a refund. If you have Windows 7 I would not recommend this camera. From everything that I did and read about it, it seems to work only with Windows 10 systems.",1,Logitech,2025-05-09T14:45:26.000Z,2025-08-23T02:40:31.000Z,2025/5/3 00:00
1,1 - US,1,147,gl_pc,B01N5UOYC4,B01N5UOYC4,75994495641,ONLY 30 FPS AT 4K,ONLY 30 FPS AT 4K<br />The product page is misleading. This product only offers 30 fps at 4k. It's a great webcam otherwise but misleading product page.,3,Logitech,2025-05-11T02:31:43.000Z,2025-08-22T21:03:44.000Z,2025/5/10 00:00
1,1 - US,1,147,gl_pc,B01N5UOYC4,B01N5UOYC4,76118321721,Nice and better for zoom in features,Excellent but I wish the zoom had more capabilities. It is so much better than my other Logitech cameras. I am a Logitech fan. I needed this one with zoom features for green screen and even with the zoom in feature I still need to bring everything closer.,4,Logitech,2025-05-17T12:20:50.000Z,2025-08-24T03:49:32.000Z,2025/5/17 00:00
1,1 - US,1,147,gl_pc,B01N5UOYC4,B01N5UOYC4,76148512441,Recomendada,En pleno 2025 cuando ya han pasado varios años desde que se lanzó esta versión yo decidí adquirirla porque por mi trabajo homeoffice siempre tengo que estar en meetings con la cámara encendida y funciona perfectamente.,5,Logitech,2025-05-18T21:38:47.000Z,2025-08-23T00:19:09.000Z,2025/5/17 00:00
1,1 - US,1,147,gl_pc,B01N5UOYC4,B01N5UOYC4,76155794771,"Slow shipping, 3rd party doesn’t honor expedited shipping.",Hasn’t even shipped 12 hours after it was supposed to arrive.,1,Logitech,2025-05-19T05:34:47.000Z,2025-05-20T17:39:31.000Z,2025/5/17 00:00
1,1 - US,1,147,gl_pc,B01N5UOYC4,B01N5UOYC4,76184208871,Good but not great,The camera itself is well tdesigned and sturdy.  It comes with a USB A to C cable/adapter.  The software application provided is limited in functionality.  It's not as accurate as I had hoped with Windows Hello for loggin on to my PC (no whaere near as good as my Dell built in laptop comaera).,4,Logitech,2025-05-20T15:36:03.000Z,2025-08-24T20:30:24.000Z,2025/5/17 00:00
1,1 - US,1,147,gl_pc,B01N5UOYC4,B01N5UOYC4,76206131291,"Be aware, this is an older model.","Be aware, this is an older model. This is not the 960-001105 as stated, but older model V-U0040. That's why it is less expensive.",1,Logitech,2025-05-21T15:56:37.000Z,2025-08-07T11:41:22.000Z,2025/5/17 00:00
1,1 - US,1,147,gl_pc,B01N5UOYC4,B01N5UOYC4,76591475051,Logitech lowest (personal) budget webcam,I think you could spend $50 more for a better webcam,3,Logitech,2025-06-09T04:07:49.000Z,2025-08-22T09:40:26.000Z,2025/6/7 00:00
1,1 - US,1,147,gl_pc,B01N5UOYC4,B01N5UOYC4,76838938311,Works out of the box. Good picture,Suits on top of monitor. Picture quality fine. No complaints on sound. Only use it for zoom,5,Logitech,2025-06-21T00:39:27.000Z,2025-08-24T09:07:41.000Z,2025/6/21 00:00
1,1 - US,1,147,gl_pc,B01N5UOYC4,B01N5UOYC4,76870061201,Good,"So good, i really love it video quality was so good, software not the best but it's helpful",5,Logitech,2025-06-22T18:19:48.000Z,2025-07-02T00:50:48.000Z,2025/6/21 00:00
1,1 - US,1,147,gl_pc,B01N5UOYC4,B01N5UOYC4,76896522661,Price and functionality,This is a very nice web cam. For my streaming.  I'm very pleased.,5,Logitech,2025-06-23T21:50:50.000Z,2025-08-24T09:54:57.000Z,2025/6/21 00:00
1,1 - US,1,147,gl_pc,B01N5UOYC4,B01N5UOYC4,76987284371,Very poor camera quality,I am extremely disappointed in this webcam. I bought this and was excited to start a podcast with my friend. The camera quality is trash and it is super blurry and not clear at all even though it says 4k.<br />I would have returned it if I didn’t wait too long to open the box. Now I’ve missed the return window and stuck with an item I hate. Total waste of $130,1,Logitech,2025-06-28T06:19:36.000Z,2025-08-16T23:54:35.000Z,2025/6/28 00:00
1,1 - US,1,147,gl_pc,B01N5UOYC4,B01N5UOYC4,77043381631,This camera is garbage,Why did you pick this product vs others?:<br />This camera is terrible. The resolution is horrible. The color is terrible. It constantly bounces back-and-forth between orange and red and the colors do not stay consistent no matter what this is the biggest waste of money I’ve ever spent garbage absolute garbage.,1,Logitech,2025-07-01T03:58:48.000Z,2025-08-13T21:32:26.000Z,2025/6/28 00:00
1,1 - US,1,147,gl_pc,B01N5UOYC4,B01N5UOYC4,77072990481,Only for live chat not recording in my opinion.,"I read another review stating that this camera had this weird glitch that causes this line/streak to flash across the screen randomly.<br /><br />That statement is absolutely true. If you’re going to be recording don’t buy it.<br /><br />Just live chat, I guess it won’t matter but would still be annoying.",3,Logitech,2025-07-02T14:41:23.000Z,2025-08-24T04:06:25.000Z,2025/6/28 00:00
1,1 - US,1,147,gl_pc,B01N5UOYC4,B01N5UOYC4,77079779121,Does not work on Google Meet and Zoom,"[[VIDEOID:c013bd6f4289d6d7ca9b88ede7a659e2]] This camera is worse than the Logitech c920s Pro which is less than half the price. I tried using it for video calls on both zoom and Google and it's poor quality and blurry. I guess it may have other use cases, but if you're buying it to use on Zoom or Google video call I would steer clear, and save your time and money. ",1,Logitech,2025-07-02T20:50:49.000Z,2025-07-04T22:55:57.000Z,2025/6/28 00:00
1,1 - US,1,147,gl_pc,B01N5UOYC4,B01N5UOYC4,77236099341,WORTH THE PRICE,"This thing is great! Video quality is smooth, and it’s great for streaming! I 100% recommend",5,Logitech,2025-07-10T17:00:58.000Z,2025-08-24T16:16:58.000Z,2025/7/5 00:00
1,1 - US,1,147,gl_pc,B01N5UOYC4,B01N5UOYC4,77359577531,Don't waste your money!,"This webcam worked great on Windows 10, but after I upgraded to Windows 11, I lost all resolutions above 1080P. There is no solution to this, as it seems to be a problem with the Logitech driver, which is now ancient. I thought it was my computer, and then I bought a new one. Same issue. It is still being sold as a 4k camera, so I decided to post this review. The camera will only connect at USB 2.0 speeds on Windows 11. I was looking for 4k support and Windows Hello support as my primary needs. I ordered a cheap $60 Chinese camera for my work computer and it meets all my needs at less than half the price. The Windows Hello facial recognition works much better than on the Brio. Don't buy this if you're on Windows 11, because you only get 1080P and Logitech clearly hopes that you don't notice. Windows has a camera test app to verify this.",1,Logitech,2025-07-16T02:56:43.000Z,2025-08-23T03:10:59.000Z,2025/7/12 00:00
1,1 - US,1,147,gl_pc,B01N5UOYC4,B01N5UOYC4,77511787131,Known issue with camera!,"Do not buy this camera. It worked for a few months, but then it began to falter. There is a reddit thread describing the problem I'm experiencing. Basically, on a zoom call, every 10 minutes or so, the video goes completely blurry. It can only be solved by turning the camera off and on again. This is very distracting for the person on the other end. See reddit thread: https://www.reddit.com/r/logitech/comments/1ea39x5/brio_4k_random_zoom_and_focus_issue/",1,Logitech,2025-07-22T18:37:22.000Z,2025-07-25T02:47:04.000Z,2025/7/19 00:00
1,1 - US,1,147,gl_pc,B01N5UOYC4,B01N5UOYC4,77550262451,Buena calidad de imagen,Muy buena calidad,5,Logitech,2025-07-24T10:27:10.000Z,2025-08-23T18:34:59.000Z,2025/7/19 00:00
1,1 - US,1,147,gl_pc,B01N5UOYC4,B01N5UOYC4,77579508381,Very clear and no lagging!!,Works great and video is super crisp!,5,Logitech,2025-07-25T17:28:41.000Z,2025-07-27T21:54:06.000Z,2025/7/19 00:00
1,1 - US,1,147,gl_pc,B01N5UOYC4,B01N5UOYC4,77679802261,Using it on Ubuntu.,Seems to work great with Linux Ubuntu. google Meets at least.,5,Logitech,2025-07-30T03:21:01.000Z,2025-08-23T20:26:07.000Z,2025/7/26 00:00
1,1 - US,1,147,gl_pc,B01N5UOYC4,B01N5UOYC4,77681199031,Increíble,"Increíble cámara, funciona en 4k",5,Logitech,2025-07-30T05:04:59.000Z,2025-08-23T18:23:41.000Z,2025/7/26 00:00
1,1 - US,1,147,gl_pc,B01N5UOYC4,B01N5UOYC4,77699437661,Hello friendly vamera,"This was an upgrade from a model C900, which lacked Hello required technology.  It works spendidly with Win11Pro.",5,Logitech,2025-07-31T02:33:47.000Z,2025-08-23T22:32:33.000Z,2025/7/26 00:00
1,1 - US,1,147,gl_pc,B01N5UOYC4,B01N5UOYC4,77875374561,"USB Port on back of camera is faulty, camera only lasted 6 months","I used this camera for a mobile streaming setup, so if you plan on just plugging this in and never moving it you probably don't need to worry about this as much as I did...<br /><br />The USB-C port on the back of the camera became loose over time and now it no longer connects to the computer. The camera worked great for the most part, but repeated use of the USB-C port (transporting it required disassembling the cable from the camera) caused it to come loose internally and no longer works. I tried reviewing the seller who sold it to me, as it was supposed to be brand new but came used, but they have since deleted their account.<br /><br />Once again, if you plan on just hooking this up and forgetting about it, this might not be an issue for you. I think in later models they corrected this by simply attaching the cord to the camera, however this is something that affected my review tremendously as I now have a $170 paperweight that isn't even heavy enough to hold papers down.",1,Logitech,2025-08-07T17:06:25.000Z,2025-08-09T11:35:57.000Z,2025/8/2 00:00
1,1 - US,1,147,gl_pc,B01N5UOYC4,B01N5UOYC4,77922804101,El mejor precio,Excelente producto,5,Logitech,2025-08-09T17:06:31.000Z,2025-08-12T01:22:07.000Z,2025/8/9 00:00
1,1 - US,1,147,gl_pc,B01N5UOYC4,B01N5UOYC4,78079993111,Lasted for 4 months,"I have had multiple logitechs and when I bough the Brio I felt I was getting the top of the line. I run a podcast and I often do hours of video conferencing in a single day.  Now 8 months later the camera constantly switches the field of view and zooms in, is super pixelated. At the rate of once every 5 minutes. And I have to turn it off and on to get back to the setting. I was suspicious that it was the internet, so we fixed that, replaced the cables and connectors and it's the same issue. When looking on Reddit I saw that this is a KNOWN issue. Camera is useless. I wished i could return this but missed the window. If you are a podcaster or need to rely on a professional camera - this is not it. I ended up buying a professional Canon EOS - it's just too much time and energy wasted to try to troubleshoot this",1,Logitech,2025-08-16T19:24:19.000Z,2025-08-18T13:14:50.000Z,2025/8/16 00:00
1,1 - US,1,147,gl_pc,B01N5UOYC4,B01N5UOYC4,78089573611,Perfect for my needs!,"I’m giving it 4/5 but honestly idk if this couple be any better, I’m just not a webcam expert lol<br />But it’s absolutely perfect for my remote job that is mostly virtual meetings where the webcam quality is important. Also surprisingly clips on to my very slim laptop (macbook air) pretty well<br />It did not disappoint!<br />FYI:<br />-I have the webcam plugged into a usb to usbc port and it works just fine<br />-it did at one point randomly have a weird glitchy effect on zoom.. but i found that if i changed the zoom camera setting to HD, completely solved it<br />-i downloaded the logitune app, haven't really needed to use it though",4,Logitech,2025-08-17T04:03:59.000Z,2025-08-23T00:07:11.000Z,2025/8/16 00:00
1,1 - US,1,147,gl_pc,B01N5UOYC4,B01N5UOYC4,78122284671,Inconsistent,"Picture is great, love the zoom and FOV settings but 2 years after use it sometimes won’t turn on or cuts out during active calls. Very frustrating to have happen.",3,Logitech,2025-08-18T17:32:10.000Z,2025-08-23T17:18:48.000Z,2025/8/16 00:00
1,1 - US,1,147,gl_pc,B01N5UOYC4,B01N5UOYC4,78210288801,Merci AMAZON,Exactement ce que j'attendais de ce produit. Merci AMAZON.,5,Logitech,2025-08-22T19:59:04.000Z,2025-08-24T08:06:05.000Z,2025/8/16 00:00
1,1 - US,1,147,gl_pc,B0BCKKPVCH,B09QW1WVRD,76103586171,Awful customer service firmware and software issues.,Logitech has the worst customer service.  You are in an infinite loop with an ai chat bot and then when we get someone they have no clue how to fix the problem.  This was not plug and play out of the box and the firmware update would not install at all.  So it was a bricked product.  I returned it and will not be shopping for Logitech ever again.,1,Logitech,2025-05-16T18:49:06.000Z,2025-08-21T12:06:25.000Z,2025/5/10 00:00
1,1 - US,1,147,gl_pc,B0BCKKPVCH,B09QW1WVRD,76446656361,3 Months Use and Stop working.,"I purchased this in Nov 2024. Just a week ago, I plug it in after moving my computer and not using it for three months. It got hot and does not work. I got about 3 months out of it. It was nice while it was working to bad it does not last.",2,Logitech,2025-06-02T14:57:09.000Z,2025-08-24T08:08:32.000Z,2025/5/31 00:00
1,1 - US,1,147,gl_pc,B0BCKKPVCH,B09QW1WVRD,77261145321,Excellent!,I literally use this camera every single day. This is perfect! Such great quality. Amazing!,5,Logitech,2025-07-11T19:09:38.000Z,2025-08-24T09:24:21.000Z,2025/7/5 00:00
1,1 - US,1,147,gl_pc,B0BCKKPVCH,B09QW1WVRD,78201679461,Very cute but not good quality camera for the price.,"Very cute webcam with nice design aesthetically, but not a good quality for the price. I have a $30 webcam from Walmart that seems better.",2,Logitech,2025-08-22T14:02:51.000Z,2025-08-24T06:04:13.000Z,2025/8/16 00:00
1,1 - US,1,147,gl_pc,B0BCKKPVCH,B09QWVYK6V,75796039131,wide,wide,5,Logitech,2025-04-30T19:08:31.000Z,2025-08-24T06:52:40.000Z,2025/4/26 00:00
1,1 - US,1,147,gl_pc,B0BCKKPVCH,B09QWVYK6V,75962559781,Good webcam,Usted it a lot for school AND streaming AND its good. The quality its great for its price,5,Logitech,2025-05-09T06:29:42.000Z,2025-08-22T20:40:42.000Z,2025/5/3 00:00
1,1 - US,1,147,gl_pc,B0BCKKPVCH,B09QWVYK6V,76311413671,Can't lose with quality Logitech products,Excellent picture quality. Easy to mount and adjust. Logi Tune is a great (free) set of software tools to manage this camera's features.,5,Logitech,2025-05-26T23:25:08.000Z,2025-08-24T06:06:32.000Z,2025/5/24 00:00
1,1 - US,1,147,gl_pc,B0BCKKPVCH,B09QWVYK6V,77729422811,Good webcam,"Nice device, it does a lot of video adjustments without the need for software, which helps it work better than similar webcams. I use one at work and at home. I'm not disappointed in the quality.",5,Logitech,2025-08-01T13:18:52.000Z,2025-08-24T06:21:24.000Z,2025/7/26 00:00
1,1 - US,1,147,gl_pc,B0BCKKPVCH,B09WHTMF23,75461777511,Great video cam,Great improvement over my laptop webcam.,5,Logitech,2025-04-13T00:28:28.000Z,2025-08-24T06:57:39.000Z,2025/4/12 00:00
1,1 - US,1,147,gl_pc,B0BCKKPVCH,B09WHTMF23,75649244691,Does NOT Work With Windows Hello,"Works fine for everything else in Windows 11, but does not have infrared so Windows Hello does not recognize this webcam.",3,Logitech,2025-04-23T01:16:36.000Z,2025-08-22T21:03:24.000Z,2025/4/19 00:00
1,1 - US,1,147,gl_pc,B0BCKKPVCH,B09WHTMF23,76664293841,"Improved over the HD920, but auto-dimming needs some improvement.","Pretty good overall.  Some people viewing my image complained about it appearing ""flat,"" and inexplicably the image darkened considerably with strong light from one side.  Would recommend for use in an environment where lighting was coming in from both sides.",4,Logitech,2025-06-12T17:07:53.000Z,2025-08-24T06:07:18.000Z,2025/6/7 00:00
1,1 - US,1,147,gl_pc,B0BCKKPVCH,B09WHTMF23,76703759851,Good for work calls,"Great webcam, but you need to download a program to change the frame size, which I can't do on my work computer. I use it for work calls on Teams.<br />Resolution is great and it's easy to plug in and use right away. I don't use the microphone, so I can't speak to its functionality.",5,Logitech,2025-06-14T18:09:06.000Z,2025-08-24T06:57:37.000Z,2025/6/14 00:00
1,1 - US,1,147,gl_pc,B0BCKKPVCH,B09WHTMF23,76828366951,Looking good after a week,"I like the camera design. It fit onto the top of my 27” Dell monitor nicely. I hadn’t had a microphone or camera on my desktop and this resolves that.<br /><br />My only complaint is that it doesn’t support Windows Hello. I neglected to check that before the purchase. I had just assumed that if the camera built into my 3 year old laptop supports it, surely any new camera in the price range would. That’ll teach me to assume. I’m going to keep the camera but probably would have bought another had I realized this.",4,Logitech,2025-06-20T21:20:07.000Z,2025-08-24T07:32:43.000Z,2025/6/14 00:00
1,1 - US,1,147,gl_pc,B0BCKKPVCH,B09WHTMF23,76943864371,Quality of material too fragile,"The privacy cover is too sensitive and just broke with about four months using about 3 days a week at most. Video quality is OK, but the resistance of the material is not as good as the price would suggest.",3,Logitech,2025-06-26T05:17:12.000Z,2025-08-24T07:53:57.000Z,2025/6/21 00:00
1,1 - US,1,147,gl_pc,B0BCKKPVCH,B09WHTMF23,77047280411,Used Item delivered and Not New!!!!,"Quality<br />I took possession of this item today and would say I was disappointed to see that I got a used item and not new. When I was ordering the item, I ordered it as a new item and not used. Hence, I consider this a rather fraudulent thing to happen on the Amazon platform. This has seriously dented my confidence in doing business on the Amazon platform. Because it was a used product, The box did not contain any instructional materials.",3,Logitech,2025-07-01T09:44:48.000Z,2025-07-24T04:30:14.000Z,2025/6/28 00:00
1,1 - US,1,147,gl_pc,B0BCKKPVCH,B09WHTMF23,77301585161,Works well,Employee I got it for has no complaints so must be working well.,5,Logitech,2025-07-13T19:44:40.000Z,2025-08-24T05:57:32.000Z,2025/7/12 00:00
1,1 - US,1,147,gl_pc,B0BCKKPVCH,B09WHTMF23,77389992451,Great lens,"Easy to use, intuitive. The mic is not the best, though.",4,Logitech,2025-07-17T12:39:57.000Z,2025-08-24T07:54:09.000Z,2025/7/12 00:00
1,1 - US,1,147,gl_pc,B0BCKKPVCH,B09WHTMF23,77433958101,Overpriced for the quality,Poor image quality and poor low light resolution. Colors are not accurate either. Way too expensive for the quality. It’s going back.,1,Logitech,2025-07-19T13:38:46.000Z,2025-08-21T01:59:25.000Z,2025/7/19 00:00
1,1 - US,1,147,gl_pc,B0BCKKPVCH,B09WHTMF23,77496627601,Clear and Light Balancing are definite perks,"Use it for work from home and it is great.<br />Easy setup and the mount is good. I had to steady mine on my shelf from the top down to keep it from jiggling as I type.<br />Camera is very clear, many times better than the one on the laptop.<br />I like that it auto adjusts for the lighting in the room. Others left me either washed out or too dark, this one has the right setting presets and keeps me looking natural.<br />Would buy again.",5,Logitech,2025-07-22T02:16:10.000Z,2025-08-24T06:36:47.000Z,2025/7/19 00:00
1,1 - US,1,147,gl_pc,B0BCKKPVCH,B09WHTMF23,77736625981,Actually decent choice for a webcam,"Item was received undamaged, and works as intended.",5,Logitech,2025-08-01T19:50:13.000Z,2025-08-24T06:22:05.000Z,2025/7/26 00:00
1,1 - US,1,147,gl_pc,B0BCKKPVCH,B09WHTMF23,77872389041,Works as Advertised,"Works very well and easy to install and integrates with all the video chat mediums that I have used: Teams, Google Chat, Zoom, etc.",5,Logitech,2025-08-07T13:57:43.000Z,2025-08-24T08:25:03.000Z,2025/8/2 00:00
1,1 - US,1,147,gl_pc,B0BCKKPVCH,B09WHTMF23,77967151261,Video Camera,"No auto focus. Hard to focus.<br /><br />Second, there is distance view program.<br /><br />Probably should had investigated better.<br /><br />I do like the simply plug install.",3,Logitech,2025-08-11T17:41:54.000Z,2025-08-24T09:18:45.000Z,2025/8/9 00:00
1,1 - US,1,147,gl_pc,B0BCKKPVCH,B09WHTMF23,78064905951,Works,"Great camera, but needs software to perform better, have to look to LOGI to obtain",4,Logitech,2025-08-15T21:53:20.000Z,2025-08-23T12:03:47.000Z,2025/8/9 00:00
1,1 - US,1,147,gl_pc,B0BCKKPVCH,B09WHTMF23,78146535821,USB-C only,This camera ONLY comes with a USB-C connector and no adapters.<br /><br />I bought this for an interview and was unable to connect it because my desktop doesn't have a USB-C plug and I do not own a laptop.,2,Logitech,2025-08-19T19:56:32.000Z,2025-08-21T15:53:57.000Z,2025/8/16 00:00
